Numer_zgloszenia;Numer_prawa_wylacznego;Data_pierwszenstwa;Data_zgloszenia;Numer_BUP;Data_Publikacji_BUP;Numer_WUP;Data_Publikacji_WUP;Tytul;Uprawnieni;Tworcy;Pelnomocnicy;Klasyfikacja_MKP;Status_sprawy;
277213;;;1989-01-16;15/1990;1990-07-23;;;Urządzenie światłowodowe do leczenia światłem;RADIOTECHNICESKIJ INSTITUT IMIENI A.L.MINCA AKADEMII NAUK SSSR;LOZENKO ALEKSANDR SERGEEVIC RECICKIJ VLADIMIR ILIC SENDALEV VIKTOR NIKOLAEVIC;POLSERVICE KANCELARIA RZECZNIKÓW PATENTOWYCH SP. Z O.O. ul. Bluszczańska 73 00-712 Warszawa;G02B;Decyzja o umorzeniu postępowania;
277214;;;1989-01-16;15/1990;1990-07-23;;;Sposób nanoszenia powłok z materiałów proszkowych na powierzchni;Institut Problem Nadechnosti i Dolgorechnosti Mashin Akademii Nauk Belorusskoi SSSR;;;X99X99/00;Decyzja o umorzeniu postępowania;
277215;159571;;1989-01-16;14/1990;1990-07-09;12/1992;1992-12-31;Maszyna jezdna do budowy torów kolejowych;FRANZ PLASSER BAHNBAUMASCHINEN-INDUSTRIEGESELLSCHAFT m.b.H.;;Bogacki Grzegorz;E01B29/05 E01B27/17;Decyzja o wygaśnięciu prawa wyłącznego (brak opłaty za ochronę);
277216;159317;;1989-01-16;17/1989;1989-08-21;12/1992;1992-12-31;Maszyna jezdna do elektrycznego zgrzewania oporowego doczołowego obu końców szyn;FRANZ PLASSER BAHNBAUMASCHINEN-INDUSTRIEGESELLSCHAFT m.b.H.;;Bogacki Grzegorz;E01B11/44 B23K11/10;Decyzja o wygaśnięciu prawa wyłącznego (brak opłaty za ochronę);
277217;159776;;1989-01-16;17/1989;1989-08-21;01/1993;1993-01-29;Urządzenie do przesuwania szyn układanego toru kolejowego;FRANZ PLASSER BAHNBAUMASCHINEN-INDUSTRIEGESELLSCHAFT m.b.H;;Bogacki Grzegorz;E01B33/08 E01B31/02;Decyzja o wygaśnięciu prawa wyłącznego (brak opłaty za ochronę);
277218;159777;;1989-01-13;15/1990;1990-07-23;01/1993;1993-01-29;Regulator temperatury bezpośredniego działania;PRZEDSIĘBIORSTWO PRODUKCYJNO-USŁUGOWE "TERMEN" SPÓŁKA AKCYJNA;CETERA WŁODZIMIERZ KORDYSZ TADEUSZ;;G05D23/02;Decyzja o wygaśnięciu prawa wyłącznego (brak opłaty za ochronę);
277220;156667;;1989-01-17;15/1990;1990-07-23;04/1992;1992-04-30;Sposób utylizacji odpadów lakierowych;INSTYTUT OCHRONY ŚRODOWISKA;MNISZEK WOJCIECH SOŁTYSIAK GRAŻYNA DUDA HENRYK;;C08J11/02;Decyzja o wygaśnięciu prawa wyłącznego (brak opłaty za ochronę);
277221;;;1989-01-17;22/1989;1989-10-30;;;Palnik do spalania oleju opałowego;NOWOSĄDECKIE PRZEDSIĘBIORSTWO CERAMIKI BUDOWLANEJ;CZERWIŃSKI JANUSZ SKIBIAK ZDZISŁAW;;;Decyzja o odmowie udzielenia prawa wyłącznego;
277222;;;1989-07-13;22/1989;1989-10-30;;;Układ do kontroli stanu napełniania zbiornika;ZAKŁADY PŁYT WIÓROWYCH;SROKA LESZEK BRUDNY ADAM;;X99X99/00;Decyzja o umorzeniu postępowania;
277223;158828;;1989-01-16;15/1990;1990-07-23;10/1992;1992-10-30;Siewnik do punktowego siewu nasion;AKADEMIA ROLNICZO-TECHNICZNA;MIESZKALSKI LESZEK;;A01C7/04;Decyzja o wygaśnięciu prawa wyłącznego (brak opłaty za ochronę);
277224;;;1989-01-16;15/1990;1990-07-23;;;Sposób napełniania ziarnem zbiorników magazynowych;INSTYTUT AGROFIZYKI PAN;HORABIK JÓZEF MOLENDA MAREK;;B65G;Decyzja o umorzeniu postępowania;
277225;;;1989-01-16;15/1990;1990-07-23;;;Rozpylacz leków proszkowych;ZAKŁAD DOŚWIADCZALNY TECHNIKI MEDYCZNEJ;CZUMA BENEDYKT ZIELIŃSKI KRZYSZTOF;;A61J;Decyzja o umorzeniu postępowania;
277226;;;1989-01-16;22/1989;1989-10-30;;;Sposób otrzymywania litowców, zwłaszcza z wód kopalnianych;ZGORZELSKI ZYGMUNT;ZGORZELSKI ZYGMUNT MASIBRODZKI GRZEGORZ;;;Decyzja o umorzeniu postępowania;
277227;;;1989-01-16;16/1989;1989-08-07;;;Komora spalania z gniazdem ósemkowym w tłoku;PIETYRA JACEK;PIETYRA JACEK;;;Decyzja o umorzeniu postępowania;
277228;;;1989-01-16;16/1989;1989-08-07;;;Komora spalania z gniazdem ósemkowym w głowicy;PIETYRA JACEK;PIETYRA JACEK;;;Decyzja o umorzeniu postępowania;
277229;158829;;1989-01-16;15/1990;1990-07-23;10/1992;1992-10-30;Pompa wirowo-strumieniowa;POLITECHNIKA WROCŁAWSKA;GAJEWSKI WŁODZIMIERZ;Rozmus Bogusław;F04F5/02 F04D9/06;Decyzja o wygaśnięciu prawa wyłącznego (brak opłaty za ochronę);
277230;157863;;1989-01-16;15/1990;1990-07-23;07/1992;1992-07-31;Sposób wytwarzania superfosfatu granulowanego oraz urządzenie do wytwarzania superfosfatu granulowanego;KOPALNIE I ZAKŁADY PRZETWÓRCZE SIARKI "SIARKOPOL";PLEBANKIEWICZ MARIAN CZEREPAK STANISŁAW SEMENIUK WŁADYSŁAW PINDUR ADAM FOLTYN TADEUSZ ZIELIŃSKI JERZY KNOLL ANDRZEJ CIECIERSKI EDWARD KASZUB LECH;;C05B19/02 B07B4/02;Decyzja o wygaśnięciu prawa wyłącznego (brak opłaty za ochronę);
277231;159063;;1989-01-16;15/1990;1990-07-23;11/1992;1992-11-30;Sposób i urządzenie do suszenia wycierki ziemniaczanej;OŚRODEK BADAWCZO-ROZWOJOWY SUSZARNICTWA PŁODÓW ROLNYCH "SUPROL" FABRYKA MASZYN ROLNICZYCH "AGROMET-ROFAMA";KIERINKIEWICZ TADEUSZ KORONKIEWICZ JAN KAŹMIERCZAK HIERONIM MICHALAK JERZY BINEK MACIEJ OSTASZEWSKI ZDZISŁAW ZAWORSKI BRONISŁAW OLSZAK JERZY MELKOWSKI ZYGFRYD;;F26B3/12;Decyzja o wygaśnięciu prawa wyłącznego (brak opłaty za ochronę);
277232;158830;;1989-01-16;15/1990;1990-07-23;10/1992;1992-10-30;Układ zabezpieczenia napędu elektrycznego wentylatora lutniowego elektro-pneumatycznego przed pracą generatorową;RYBNICKA SPÓŁKA WĘGLOWA SPÓŁKA AKCYJNA KOPALNIA WĘGLA KAMIENNEGO "1 MAJA";CZERNICKI MACIEJ MENCEL ZDZISŁAW SZCZUREK PAWEŁ KRZEMPEK ALOJZY TOMCZAK WŁADYSŁAW;;E21F9/00 H02K11/00;Decyzja o wygaśnięciu prawa wyłącznego (brak opłaty za ochronę);
277233;;;1989-01-16;22/1989;1989-10-30;;;Sposób przygotowania i laminowania dwoin ze skór naturalnych, skór naturalnych i skór wtórnych;CENTRALNE LABORATORIUM PRZEMUSŁU OBUWNICZEGO;POZNAŃSKI JAN PAROCKI ZDZISŁAW GĄSIORSKI KAZIMIERZ P. BRZOZOWSKI JAN JACKOWSKA MARIANNA ŚLUSARCZYK ADAM PASIŃSKI ZYGMUNT SITKO FRANCISZEK FILIPOWICZ WITOLD;;;Decyzja o umorzeniu postępowania;
277234;158492;;1989-01-16;13/1990;1990-06-25;09/1992;1992-09-30;Sposób i układ do biologicznego oczyszczania ścieków zwłaszcza ścieków cukrowniczych;CUKROWNIE TORUŃSKIE;HELIŃSKI RYSZARD MURAWSKI STANISŁAW MOSIEWICZ BRONISŁAW NOWAK BERNARD MARCINIAK KRYSTIAN;;C02F3/30 C02F3/28;Decyzja o wygaśnięciu prawa wyłącznego (brak opłaty za ochronę);
277235;159064;;1989-01-18;15/1990;1990-07-23;11/1992;1992-11-30;Sposób wykonania obróbek dekarskich dachów i tarasów;INSTYTUT TECHNIKI BUDOWLANEJ;MAJEWSKI SŁAWOMIR FRANCKE BARBARA HAN ZDZISŁAW GUDAJ ANTONI;Przedcieczeński Henryk;E04D13/14 E04B1/68;Decyzja o wygaśnięciu prawa wyłącznego (brak opłaty za ochronę);
277236;163458;;1989-01-17;15/1990;1990-07-23;03/1994;1994-03-31;Sposób otrzymywania węgla aktywnego w złożu fluidalnym;INSTYTUT CHEMICZNEJ PRZERÓBKI WĘGLA;LIBERACKI JANUSZ KUŚNIERZ STANISŁAW;;C01B31/10;Decyzja o wygaśnięciu prawa wyłącznego (brak opłaty za ochronę);
277237;;;1989-01-17;22/1989;1989-10-30;;;Urządzenie do pomiaru chropowatości poszycia kadłuba statku;PRZEDSIĘBIORSTWO USŁUG TECHNICZNO-BADAWCZYCH "TECHNIKOR" SPÓŁKA Z OGRANICZONĄ ODPOWIEDZIALNOŚCIĄ;WASILEWSKI JANUSZ ŚLIWICKI ANDRZEJ JAWORSKI ZBIGNIEW GODLEWSKI ANDRZEJ;;;;
277238;;;1989-01-18;15/1990;1990-07-23;;;Sposób sterowania rezonansową ręką mechaniczną;INSITUT MASINOVEDENIJA IMIENI A.A.BLAGONRAVOVA AKADEMII NAUK SSSR;AKINFIEV TEODOR SAMUILOVIC;POLSERVICE KANCELARIA RZECZNIKÓW PATENTOWYCH SP. Z O.O. ul. Bluszczańska 73 00-712 Warszawa;B25J G05D;Decyzja o umorzeniu postępowania;
277239;;1988-01-20;1989-01-18;17/1989;1989-08-21;;;Sposób wytwarzania 3-[pirydylo-3]-1H,3H-pirolo-[1,2-c]tiazolokarbonitrylu-7;Rhone-Poulenc Sante;RAJOHARISON HARIVELO GERARD;POLSERVICE KANCELARIA RZECZNIKÓW PATENTOWYCH SP. Z O.O. ul. Bluszczańska 73 00-712 Warszawa;;Decyzja o umorzeniu postępowania;
277240;160453;;1989-01-18;17/1989;1989-08-21;05/1993;1993-05-31;Kompozycja elastoplastyczna;Advanced Elastomer Systems L.P.;;POLSERVICE KANCELARIA RZECZNIKÓW PATENTOWYCH SP. Z O.O. ul. Bluszczańska 73 00-712 Warszawa;C08L51/06 C08L23/16;Decyzja o wygaśnięciu prawa wyłącznego (brak opłaty za ochronę);
277241;;1988-01-19;1989-01-18;24/1989;1989-11-27;;;Środek pobudzający wzrost przeżuwaczy i sposób wytwarzania nowych pochodnych laktonu kwasu rezorcylowego, będących czynną substancją tego środka;PITMAN-MOORE,INC.;HODGE EDWARD B.;POLSERVICE KANCELARIA RZECZNIKÓW PATENTOWYCH SP. Z O.O. ul. Bluszczańska 73 00-712 Warszawa;;Decyzja o umorzeniu postępowania;
277242;;;1989-01-17;15/1990;1990-07-23;;;Mechanizm zwijający zaczepu orczykowego;ŚLĄSKIE PRZEDSIĘBIORSTWO KONSTRUKCJI STALOWYCH I URZĄDZEŃ PRZEMYSŁOWYCH "MOSTOSTAL";PLICHTA KAZIMIERZ LINKE ZBIGNIEW;;B61B;Decyzja o umorzeniu postępowania;
277243;151393;;1989-01-17;22/1989;1989-10-30;08/1990;1990-08-31;Przekładnia obiegowo-wahliwa;DROZD ADAM;DROZD ADAM;;F16H1/40;Decyzja o odmowie udzielenia prawa wyłącznego;
277244;151364;;1989-01-17;22/1989;1989-10-30;08/1990;1990-08-31;Przekładnia bezstopniowa, obiegowo-wahliwa;DROZD ADAM;DROZD ADAM;;F16H15/50;Prawo wyłączne wygasło po okresie, na jaki zostało udzielone;
277245;159318;;1989-01-17;15/1990;1990-07-23;12/1992;1992-12-31;Fotoakustyczna komórka pomiarowa;POLITECHNIKA WROCŁAWSKA;KAMIŃSKI JAN;Żyborska Stanisława;G01N21/17 G01N21/37;Decyzja o wygaśnięciu prawa wyłącznego (brak opłaty za ochronę);
277246;;;1989-01-17;15/1990;1990-07-23;;;Sposób wytwarzania obuwniczych materiałów podpodeszwowo-wyściółkowych;OŚRODEK BADAWCZO-ROZWOJOWY KAUCZUKÓW I TWORZYW WINYLOWYCH;STARZAK MARIAN DAWIDOWICZ BOHDAN SKIBIŃSKI RYSZARD STASIAK ZENOBIUSZ;;D06N;Decyzja o umorzeniu postępowania;
277248;;;1989-01-17;15/1990;1990-07-23;;;Urządzenie do badania opon;PRZEDSIĘBIORSTWO PROJEKTOWANIA I INWESTYCJI PRZEMYSŁU GUMOWEGO "STOMIL" PRACOWNIA PROJEKTOWA;LIPIŃSKI STANISŁAW GOLCZYŃSKI LECH PRZYBYSZ ZDZISŁAW SZAFNICKI TOMASZ;;G01M;Decyzja o umorzeniu postępowania;
277249;157625;;1989-01-17;15/1990;1990-07-23;06/1992;1992-06-30;Sposób wytwarzania korundowych endoprotez;INSTYTUT MATERIAŁÓW OGNIOTRWAŁYCH;CWEN ANTONINA CZECHOWSKI JERZY LORCZYK CZESŁAW;;A61F2/30 A61L27/00 C04B35/10;Decyzja o wygaśnięciu prawa wyłącznego (brak opłaty za ochronę);
277251;;;1989-01-17;15/1990;1990-07-23;;;Zawór zaporowy z pokrywą kabłąkową;KŁODZKA FABRYKA URZĄDZEŃ TECHNICZNYCH;ŻMIJA LEOPOLD GOŁĄBEK FRANCISZEK;;F16K;Decyzja o umorzeniu postępowania;
277252;;;1989-01-17;15/1990;1990-07-23;;;Kąpiel impregnująca do wytwarzania włókienniczych wykładzin podłogowych pojazdów samochodowych;OŚRODEK BADAWCZO-ROZWOJOWY KAUCZUKÓW I TWORZYW WINYLOWYCH;STARZAK MARIAN KRZEMIEŃ WIESŁAWA DAWIDOWICZ BOHDAN SZPYLMA JAN KOŃCZAL HALINA;;D06M;Decyzja o umorzeniu postępowania;
277253;;;1989-01-17;16/1990;1990-08-06;;;Sposób i urządzenie do estymacji demdulaty pasmowego sygnału dyskretnego;NAUKOWO-PRODUKCYJNE CENTRUM PRZETWARZANIA SYGNAŁU PRZEDSIĘBIORSTWO PAŃSTWOWE;GIRYN ANDRZEJ HERMANOWICZ EWA ROJEWSKI MIROSŁAW;WOJEWÓDZKI KLUB TECHNIKI I RACJONALIZACJI ul. Rajska 6  80-850 Gdańsk;H03M;Decyzja o umorzeniu postępowania;
277254;;;1989-01-17;16/1990;1990-08-06;;;Sposób i urządzenie do estymacji demodulaty pasmowego sygnału analogowego;NAUKOWO-PRODUKCYJNE CENTRUM PRZETWARZANIA SYGNAŁU PRZEDSIĘBIORSTWO PAŃSTWOWE;GIRYN ANDRZEJ HERMANOWICZ EWA ROJEWSKI MIROSŁAW;WOJEWÓDZKI KLUB TECHNIKI I RACJONALIZACJI ul. Rajska 6  80-850 Gdańsk;H03M;Decyzja o umorzeniu postępowania;
277255;;;1989-01-19;15/1990;1990-07-23;;;Chwytak szczękowy maszyny manipulacyjnej stosowany zwłaszcza w zautomatyzowanych procesach montażu;OŚRODEK BADAWCZO-ROZWOJOWY PODSTAW TECHNOLOGII I KONSTRUKCJI MASZYN "TEKOMA";LENCZEWSKI JERZY URBAŃSKI MAREK;;B25J B23P;Decyzja o umorzeniu postępowania;
277256;159319;;1989-01-19;15/1990;1990-07-23;12/1992;1992-12-31;Stanowisko do badań odporności na drgania;OŚRODEK BADAWCZO-ROZWOJOWY MASZYN ZIEMNYCH I TRANSPORTOWYCH;KUŁAGA FRANCISZEK MAJCHROWSKI WACŁAW;Rzeczn. pat. A. Trydała;G01M7/00;Decyzja o wygaśnięciu prawa wyłącznego (brak opłaty za ochronę);
277257;158831;;1989-01-19;15/1990;1990-07-23;10/1992;1992-10-30;Zespół napędowy zaworu zabezpieczającego;JAŁOWSKI FELIKS;JAŁOWSKI FELIKS;;F16K31/02;Decyzja o wygaśnięciu prawa wyłącznego (brak opłaty za ochronę);
277258;159065;;1989-01-19;15/1990;1990-07-23;11/1992;1992-11-30;Uchwyt do wędki;ORKISZEWSKI ANDRZEJ;ORKISZEWSKI ANDRZEJ;;A01K97/10;Decyzja o wygaśnięciu prawa wyłącznego (brak opłaty za ochronę);
277259;;;1989-01-19;03/1990;1990-02-05;;;Sposób zabezpieczania palnika halogenowego przed uderzeniem prądowym w czasie rozruchu;SAWICKI JERZY PISARZEWSKI ANDRZEJ ZABOROWSKI SŁAWOMIR;SAWICKI JERZY PISARZEWSKI ANDRZEJ ZABOROWSKI SŁAWOMIR;;H02H H01J;Decyzja o umorzeniu postępowania;
277260;157626;;1989-01-19;21/1989;1989-10-16;06/1992;1992-06-30;Sposób wytwarzania nowych pochodnych tetrahydropirydyny;BOEHRINGER INGELHEIM KG;;PRZEDSIĘBIORSTWO RZECZNIKÓW PATENTOWYCH PATPOL SP. Z O.O. ul. Nowoursynowska 162 J 02-776 Warszawa;C07D211/70;Decyzja o wygaśnięciu prawa wyłącznego (brak opłaty za ochronę);
277261;163814;;1989-01-19;19/1989;1989-09-18;05/1994;1994-05-31;Sposób wytwarzania nowych analogów nukleozydów dideoksydidehydrokarbocyklicznych;REGENTS OF THE UNIVERSITY OF MINNESOTA;VINCE ROBERT HUA MEI MYERS PETER L. STORER RICHARD;Kossowska Janina;C07D473/00;Prawo wyłączne wygasło po okresie, na jaki zostało udzielone;
277262;;1988-01-21;1989-01-19;18/1989;1989-09-04;;;Zgrzebło, zwłaszcza do przenośnika zgrzebłowego łańcuchowego z podwójnym pasmem łańcucha środkowego;Gewerkschaft Eisenhütte Westfalia GmbH;TEMME HELMUT;PRZEDSIĘBIORSTWO RZECZNIKÓW PATENTOWYCH PATPOL SP. Z O.O. ul. Nowoursynowska 162 J 02-776 Warszawa;;Decyzja o umorzeniu postępowania;
277263;;1988-01-19;1989-01-19;18/1989;1989-09-04;;;Sposób wytwarzania afino-enzymatycznych związków do wizualnego wskaźnikowania cholesterolu na powierzchni skóry pacjenta;Nauchno-Issledovatelsky Institut Fiziko-Khimicheskoi Meditsiny;LOPUKHIN JURY MIKHAILOVICH ANDRIANOVA IRINA PAVLOVNA ZUEVSKY VIKTOR VIKTOROVICH RABOVSKY ALEXANDR BORISOVICH;POLSERVICE KANCELARIA RZECZNIKÓW PATENTOWYCH SP. Z O.O. ul. Bluszczańska 73 00-712 Warszawa;;Decyzja o umorzeniu postępowania;
277264;;;1989-01-14;15/1990;1990-07-23;;;Silnik spalinowy z trzema wirującymi krzywkami;PARADOWSKI JAN;PARADOWSKI JAN;;F02B;Decyzja o umorzeniu postępowania;
277265;;;1989-01-18;15/1990;1990-07-23;;;Sposób wytwarzania mączki paszowej z krwi zwierzęcej;FABRYKA MASZYN I URZĄDZEŃ PRZEMYSŁU SPOŻYWCZEGO;KASZNY WERNER ŁOŚ JÓZEF;;A23K;Decyzja o umorzeniu postępowania;
277266;;;1989-01-18;15/1990;1990-07-23;;;Układ impulsowego zasilania silnika krokowego;POLITECHNIKA GDAŃSKA;BLAUTENBERG ANDRZEJ;Politechnika Gdańska Ośrodek Ochrony Patentowej;H02P;Decyzja o umorzeniu postępowania;
277267;158194;;1989-01-18;15/1990;1990-07-23;08/1992;1992-08-31;Sposób zapobiegania awariom reaktorów utleniania węglowodorów;ZAKŁADY AZOTOWE "PUŁAWY" SPÓŁKA AKCYJNA;POCHWALSKI MAREK USZYŃSKI ALEKSANDER MARCHWIANY HENRYK WYSTUP EUGENIUSZ RYGIEL STANISŁAW ŻYLIŃSKI MAREK;;C07C27/12 C07B33/00;Decyzja o wygaśnięciu prawa wyłącznego (brak opłaty za ochronę);
277268;159320;;1989-01-18;22/1989;1989-10-30;12/1992;1992-12-31;Tyrystorowy falownik napięcia, zwłaszcza w napędzie silnika indukcyjnego średniej mocy;WYŻSZA SZKOŁA INŻYNIERSKA IM. K. PUŁASKIEGO;SZYCHTA LESZEK SZYCHTA ELŻBIETA;Głogowska Jolanta;H02P7/42;Prawo wyłączne wygasło po okresie, na jaki zostało udzielone;
277269;;;1989-01-18;15/1990;1990-07-23;;;Stanowisko i sposób transportowania i magazynowania międzyoperacyjnego palet z półwyrobami;BIURO PROJEKTÓW I KOMPLETACJI DOSTAW MASZYN I URZĄDZEŃ HUTNICZYCH "HUTMASZPROJEKT-HAPEKO";MAROŃ HUBERT TLATLIK JAN;;B65G;Decyzja o umorzeniu postępowania;
277270;162872;;1989-01-18;18/1989;1989-09-04;01/1994;1994-01-31;Sposób wytwarzania kształtek szklanych dla elektroniki;INSTYTUT SZKŁA I CERAMIKI W WARSZAWIE-ODDZIAŁ W KRAKOWIE CENTRUM NAUKOWO-PRODUKCYJNE MATERIAŁÓW ELEKTRONICZNYCH "UNITRA-CEMAT" ZAKŁAD PRODUKCJI MATERIAŁÓW ELEKTRONICZNYCH NR 2;FALKOWSKA MARIA GAWLAS JAN SUMIŃSKI JERZY SZPONDER WŁADYSŁAW TOMAL MAREK KOCISZEWSKI LONGIN KAPERA WŁADYSŁAW TYMOSZUK ROMAN MUCHA ANDRZEJ BARTULA MICHAŁ;Instytut Szkła i Ceramiki w Warszawie Oddział w Krakowie;C03C3/076;Decyzja o wygaśnięciu prawa wyłącznego (brak opłaty za ochronę);
277271;158832;;1989-01-18;15/1990;1990-07-23;10/1992;1992-10-30;Siłownik hydrauliczny;CENTRUM MECHANIZACJI GÓRNICTWA "KOMAG";LENARD JAN PRETOR WINCENTY NOWAK KAROL;Nowak Karol;F15B15/16;Decyzja o wygaśnięciu prawa wyłącznego (brak opłaty za ochronę);
277272;159066;;1989-01-18;15/1990;1990-07-23;11/1992;1992-11-30;Przekładnia obiegowa;POLITECHNIKA POZNAŃSKA;GRAJDEK RYSZARD;Ośrodek Badań i Ochrony Patentowej Oddz. PAN i Szkół Wyższych m. Poznania;F16H1/40 F16H55/17;Decyzja o wygaśnięciu prawa wyłącznego (brak opłaty za ochronę);
277273;;;1989-01-18;16/1989;1989-08-07;;;Przystosowanie istniejących osadników a w szczególności osadników Imhoffa do biologicznego sposobu oczyszczania ścieków;BEJTKA DOROTA BEJTKA JACEK KAMIŃSKA HANNA;BEJTKA DOROTA BEJTKA JACEK KAMIŃSKA HANNA;;;Decyzja o umorzeniu postępowania;
277274;;;1989-01-18;15/1990;1990-07-23;;;Zawór napowietrzająco-odpowietrzający;ZAKŁADY URZĄDZEŃ CHEMICZNYCH I ARMATURY PRZEMYSŁOWEJ CHEMAR;ŻAK BOGUSŁAW MIGALSKI FRANCISZEK BLICHARSKI HENRYK;;F16K;Decyzja o umorzeniu postępowania;
277275;;;1989-01-20;15/1990;1990-07-23;;;Urządzenie jezdne do przemieszczania się wewnątrz rurociągów;HUTNICZE PRZEDSIĘBIORSTWO REMONTOWE Veb Energiekombinat;ZAKRZEWSKI RYSZARD PUKACZ ANDRZEJ MAŹNIAK TADEUSZ PRASKI TADEUSZ PIETSCHKER GERALD SCHMIDT EVELIN;;F16L;Decyzja o wygaśnięciu decyzji warunkowej;
277276;158833;;1989-01-20;16/1989;1989-08-07;10/1992;1992-10-30;Zamek bezsprężynowy do zabezpieczania pomieszczeń;MĘCIŃSKI ZBIGNIEW HAŚ MIECZYSŁAW;MĘCIŃSKI ZBIGNIEW HAŚ MIECZYSŁAW;Zbigniew Męciński;E05B25/02;Decyzja o wygaśnięciu prawa wyłącznego (brak opłaty za ochronę);
277277;;;1989-01-20;15/1990;1990-07-23;;;Sposób elektromechanicznego usuwania zadziorów z elementów rurowych;POLITECHNIKA WARSZAWSKA;DĄBROWSKI LUCJAN KOZAK JERZY ŁUBKOWSKI KONRAD;Dział Ochrony Patentowej Politechniki Warszawskiej;B23H;Decyzja o umorzeniu postępowania;
277278;;;1989-01-20;15/1990;1990-07-23;;;Urządzenie do mineralizacji zanieczyszczeń organicznych cieczy, zwłaszcza ścieków za pomocą ozonowania;POLAŃSKI JAROSŁAW M.;POLAŃSKI JAROSŁAW M.;;C02F;Decyzja o wygaśnięciu decyzji warunkowej;
277279;157977;;1989-01-20;15/1990;1990-07-23;07/1992;1992-07-31;Ultradźwiękowa głowica sektorowa;POLSKA AKADEMIA NAUK INSTYTUT PODSTAWOWYCH PROBLEMÓW TECHNIKI;MARCINIAK ARTUR NOWICKI ANDRZEJ SECOMSKI WOJCIECH KARŁOWICZ PAWEŁ PIECHOCKI MACIEJ LIWSKI JACEK;Rutkowski Wiesław;A61B8/00 B06B3/00;Decyzja o wygaśnięciu prawa wyłącznego (brak opłaty za ochronę);
277281;153422;;1989-01-20;18/1989;1989-09-04;04/1991;1991-04-30;Kompozycja zawierająca materiał palny z wiązaniami poliuretanowymi oraz środek tłumiący wytwarzanie dymu i toksycznych gazów;CIBA-GEIGY A.G.;;POLSERVICE KANCELARIA RZECZNIKÓW PATENTOWYCH SP. Z O.O. ul. Bluszczańska 73 00-712 Warszawa;C08L75/04 C08J9/00;Decyzja o wygaśnięciu prawa wyłącznego (brak opłaty za ochronę);
277282;;1988-01-20;1989-01-20;21/1989;1989-10-16;;;Zamek magnetyczny, zwłaszcza wstawiany do mechanizmów zamykających;ELZETT-CERTA Zargyarto, Presonto es Szerszamkeszito Vallalat;KASSZA TIBOR;POLSERVICE KANCELARIA RZECZNIKÓW PATENTOWYCH SP. Z O.O. ul. Bluszczańska 73 00-712 Warszawa;;Decyzja o umorzeniu postępowania;
277283;;;1989-01-20;15/1990;1990-07-23;;;Sposób oczyszczania 2,2'-dwu-(1,6,7-trójhydroksy-3-metylo-5-izopropylo-8-formylonaftalenu);Intitut Bioorganicheskoi Khimii Akademii Nauk Uzbexkoi SSR;IBRAGIMOV BAKHTIYAR TULYAGANOVICH TALIPOV SAMAT ABDILAKHATOVICH MARDANOV RUSTAM GARUNOVICH ARIPOV TAKHIR FATIKHOVICH;;C07C47/56;Decyzja o umorzeniu postępowania;
277284;;1988-01-23;1989-01-20;19/1989;1989-09-18;;;Przekładnia;BOLLMAN HYDRAULIK GmbH;BOLLMAN DIETER;PRZEDSIĘBIORSTWO RZECZNIKÓW PATENTOWYCH PATPOL SP. Z O.O. ul. Nowoursynowska 162 J 02-776 Warszawa;;Decyzja o umorzeniu postępowania;
277285;;1988-01-21;1989-01-20;19/1989;1989-09-18;;;Sposób zapobiegania obciążeniu środowiska przez chemiczne i/albo biologiczne substancje szkodliwe, które są emitowane przez powierzchnie zabudowy;Heinz Holter;HULTER HEINZ IGELBUSCHER HEINRICH GRESCH HEINRICH DEWERT HERIBERT;PRZEDSIĘBIORSTWO RZECZNIKÓW PATENTOWYCH PATPOL SP. Z O.O. ul. Nowoursynowska 162 J 02-776 Warszawa;;Decyzja o umorzeniu postępowania;
277286;;;1989-01-21;15/1990;1990-07-23;;;Sposób wykańczania skór surowych, skóry i podobnych materiałów włóknistych;COMETA ENGINEERING S.r.l. Urgnano/Bergamo;LOCATI LUIGI CALCIATI GIOVANNI CONTI EZIO CARLESSI ANTONIO;POLSERVICE KANCELARIA RZECZNIKÓW PATENTOWYCH SP. Z O.O. ul. Bluszczańska 73 00-712 Warszawa;C14C;Decyzja o umorzeniu postępowania;
277287;;1988-01-22;1989-01-21;17/1989;1989-08-21;;;Sztuczna soczewka oka;Mezhotraslevoi Nauchno-Tekhnichesky Komplex "MIKROKHIRURGIA GLAZA";FEDOROV SVATOSLAV NIKOLAEVICH IVANOV IGOR LEONIDOVICH PASHINOVA NADEZHDA FEDEROVNA ZAKHAROV DMITRY VALERIEVICH;POLSERVICE KANCELARIA RZECZNIKÓW PATENTOWYCH SP. Z O.O. ul. Bluszczańska 73 00-712 Warszawa;;Decyzja o umorzeniu postępowania;
277288;160796;;1989-01-18;17/1989;1989-08-21;04/1993;1993-04-30;Układ przeniesienia napędu na przesuwne osiowo wrzeciono;WYŻSZA SZKOŁA INŻYNIERSKA;ZIÓŁKOWSKI STANISŁAW BOKIEJ STANISŁAW KACALAK WOJCIECH ŚCIEGIENKA RYSZARD KONFISZ JANUSZ;;B23Q5/10 B24B47/12;Decyzja o wygaśnięciu prawa wyłącznego (brak opłaty za ochronę);
277289;160797;;1989-01-18;17/1989;1989-08-21;04/1993;1993-04-30;Układ przeniesienia napędu na przesuwne osiowo wrzeciono;WYŻSZA SZKOŁA INŻYNIERSKA;ZIÓŁKOWSKI STANISŁAW BOKIEJ STANISŁAW KACALAK WOJCIECH ŚCIEGIENKA RYSZARD KONFISZ JANUSZ;;B23Q5/10 B24B47/12;Decyzja o wygaśnięciu prawa wyłącznego (brak opłaty za ochronę);
277290;158493;;1989-01-19;15/1990;1990-07-23;09/1992;1992-09-30;Stanowisko do naprawy nadwozi samochodowych;BOŃKOWSKI WITOLD;BOŃKOWSKI WITOLD;;B21D1/12;Decyzja o wygaśnięciu prawa wyłącznego (brak opłaty za ochronę);
277291;158834;;1989-01-19;15/1990;1990-07-23;10/1992;1992-10-30;Siłownik prasowarki do odzieży;FABRYKA URZĄDZEŃ PRASOWALNICZYCH "PROTOMET";WORKERT STEFAN;;F15B9/06;Decyzja o wygaśnięciu prawa wyłącznego (brak opłaty za ochronę);
277292;158835;;1989-01-19;15/1990;1990-07-23;10/1992;1992-10-30;Prasulec do prasowania odzieży;FABRYKA URZĄDZEŃ PRASOWALNICZYCH "PROTOMET";WORKERT STEFAN;;D06F81/00;Decyzja o wygaśnięciu prawa wyłącznego (brak opłaty za ochronę);
277293;;;1989-01-19;16/1989;1989-08-07;;;Stelaż, zwłaszcza do rysunków technicznych;ZAKŁAD BUDOWY MASZYN "ZREMB";KARPUS RADZISŁAW KUREK HIERONIM STANKE TADEUSZ MIĘSIKOWSKI JANUARY BRZEZIŃSKI ROMAN DROBIŃSKI MAREK CHARKOWY ANDRZEJ CEMKA KAZIMIERZ;;;Decyzja o wygaśnięciu decyzji warunkowej;
277294;159321;;1989-01-19;15/1990;1990-07-23;12/1992;1992-12-31;Sprzęgło zębate dwuwieńcowe;TORUŃSKIE ZAKŁADY URZĄDZEŃ OKRĘTOWYCH "TOWIMOR" SPÓŁKA AKCYJNA;ZASADZKI ZBIGNIEW;;F16D3/18;Decyzja o wygaśnięciu prawa wyłącznego (brak opłaty za ochronę);
277295;;;1989-01-19;15/1990;1990-07-23;;;Sposób i urządzenie do odpylania górniczych wyrobisk, zwłaszcza korytarzowych;KOPALNIA WĘGLA KAMIENNEGO "SIEMIANOWICE";BŁĄKAŁA BOGDAN STRZEMIŃSKI JERZY MARCOL JÓZEF PLUSZCZYK ROMAN;;E21F;Decyzja o umorzeniu postępowania;
277296;157627;;1989-01-19;15/1990;1990-07-23;06/1992;1992-06-30;Odkraplacz cieczy z aerozolu;HUTA ALUMINIUM "KONIN" SPÓŁKA AKCYJNA;PRZYBYLSKI HENRYK LAZAR ZDZISŁAW;;B01D45/16;Decyzja o wygaśnięciu prawa wyłącznego (brak opłaty za ochronę);
277297;;;1989-01-19;22/1989;1989-10-30;;;Sposób wykonania chłodnicy płytowej;WYTWÓRNIA SPRZĘTU KOMUNIKACYJNEGO "PZL-WSK-KRAKÓW";JAGUŚ CZESŁAW ŚWIERZOWSKI ROMAN;;;Decyzja o umorzeniu postępowania;
277298;;;1989-01-19;20/1989;1989-10-02;;;Sposób mocowania modelu wlewu głównego do płyty modelowej i model wlewu głównego, zwłaszcza do formowania na automatycznych liniach formierskich;PRZEDSIĘBIORSTWO MECHANIZACJI AUTOMATYZACJI I ELEKTRONIKI GÓRNICZEJ "POLMAG-EMAG" SOSNOWIECKIE ODLEWNIE STALIWA "SOSTAL";NAZIMEK STANISŁAW;Komórka Wynalazczości Sosnowieckich Odlewni Staliwa "SOSTAL";;Decyzja o umorzeniu postępowania;
277299;;;1989-01-19;20/1989;1989-10-02;;;Sposób i przyrząd do blokowania wałka z nożami przy strugarkach do drewna;PRZEDSIĘBIORSTWO MECHANIZACJI AUTOMATYZACJI I ELEKTRONIKI GÓRNICZEJ "POLMAG-EMAG" SOSNOWIECKIE ODLEWNIE STALIWA "SOSTAL";BUJAK JANUSZ;Komórka Wynalazczości Sosnowieckich Odlewni Staliwa "SOSTAL";;Decyzja o umorzeniu postępowania;
277300;160562;;1989-01-20;15/1990;1990-07-23;05/1993;1993-05-31;Mechanizm do zmiany położenia łopatek wirnika, zwłaszcza turbiny wodnej;POLITECHNIKA GDAŃSKA;ŻOCHOWSKI KAZIMIERZ OGONOWSKI ANDRZEJ;Popławski Czesław;F03B3/06;Decyzja o wygaśnięciu prawa wyłącznego (brak opłaty za ochronę);
277301;;;1989-01-20;15/1990;1990-07-23;;;Palnik do cięcia łukowo-tlenowego zwłaszcza pod wodą;POLITECHNIKA GDAŃSKA;GADOMSKI ZBIGNIEW LESIŃSKI KRZYSZTOF JANUSZ ROMANOWSKI PAWEŁ PIĄTKOWSKI TADEUSZ;Politechnika Gdańska Ośrodek Ochrony Patentowej;B23K;Decyzja o umorzeniu postępowania;
277302;;;1989-01-20;15/1990;1990-07-23;;;Stanowisko do symulowanego badania zespołu koła zębatego z dwiema zębatkami;POLITECHNIKA GDAŃSKA;PASIŃSKI JERZY STAWARZ JERZY ŚWITAŁA HENRYK KRÓL MARIAN OSTACHOWICZ WIESŁAW PAŁŻEWICZ ANDRZEJ;Politechnika Gdańska Ośrodek Ochrony Patentowej;G01M;Decyzja o umorzeniu postępowania;
